{
  "format": "character-4dir",
  "version": 1,
  "id": "mukuro-red-cape-v1",
  "image": "sprites-32.png?v=a95add2be395",
  "tileSize": 32,
  "columns": 3,
  "rows": 4,
  "width": 96,
  "height": 128,
  "directions": [
    "south",
    "west",
    "east",
    "north"
  ],
  "anchor": [
    16,
    29
  ],
  "displayScale": 1.25
}
